{
  "$schema": "https://i2group.github.io/notebook-sdk/schemas/plugin-manifest.json",
  "name": "dialog-sample-plugin",
  "pluginId": "dff93a38-4e4d-49f7-a4f0-3dc27060ed10",
  "pluginVersion": "1.0.0",
  "entryPointUrl": "./entrypoint.js",
  "entryPointCsp": {
    "script-src": "'unsafe-eval'",
    "connect-src": "*"
  },
  "toolViewCsp": {
    "script-src": "'unsafe-eval' 'unsafe-inline'",
    "style-src": "'unsafe-inline'",
    "connect-src": "*"
  }
}
